<?xml version="1.0" encoding="UTF-8"?>
<zahtev_za_priznanje_ziga xmlns="http://www.tim777.rs/dokumentZ1"
    xmlns:xsi="http://www.w3.org/2001/XMLSchema-instance"
    xsi:schemaLocation="http://www.tim777.rs/dokumentZ1 file:/C:/Users/PC/Desktop/fax/VII_semestar/XML/XML-project/KT2/Z1.xsd">
    <podnosilac xsi:type='TFizicko_lice'>
        <adresa>
            <drzava>Srbija</drzava>
            <postanski_broj>15318</postanski_broj>
            <mesto>Mali Zvornik</mesto>
            <ulica>Kralja PEtra I br 6</ulica>
        </adresa>
        <kontakt>
            <telefon>065421654</telefon>
            <email>mladen@dmsak.com</email>
            <fax>06530321</fax>
        </kontakt>
        <ime>'Mladen'</ime>
        <prezime>'Gajic'</prezime>
    </podnosilac>
    <punomocnik xsi:type='TPravno_lice'>
        <adresa>
            <drzava>Srbija</drzava>
            <postanski_broj>21000</postanski_broj>
            <mesto>Novi Sad</mesto>
            <ulica>Veselina Maslese 2</ulica>
        </adresa>
        <kontakt>
            <telefon>6506132130</telefon>
            <email>korpa@dsmak.com</email>
            <fax>560061032</fax>
        </kontakt>
        <Naziv>Korpa d.o.o.</Naziv>
    </punomocnik>
    <opis_ziga>
        <tip_ziga>individualni_zig</tip_ziga>
        <znak>
            <izgled_znaka>https://www.izgled.com/mojzig</izgled_znaka>
            <vrsta_znaka>graficki</vrsta_znaka>
            <boje_znaka>
                <boja>plava</boja>
                <boja>crvena</boja>
            </boje_znaka>
            <transliteracija></transliteracija>
            <prevod>nyokosuzi</prevod>
            <opis_znaka>licni pecat </opis_znaka>
        </znak>
    </opis_ziga>
    <brojevi_klasa_robe_usluga>
        <broj>2</broj>
        <broj>5</broj>
        <broj>17</broj>
    </brojevi_klasa_robe_usluga>
    <zatrazeno_pravo_prvenstva>
        <pravo>pravo broj 128</pravo>
        <osnov>osnov broj 21 sadmd po ustavu dsaknda</osnov>
    </zatrazeno_pravo_prvenstva>
    <placanje>
        <onsovna_taksa>123</onsovna_taksa>
        <graficko_resenje>450</graficko_resenje>
        <ukupno>965</ukupno>
    </placanje>
    <prilozi>
        <primerak_znaka>https://www.prilog.com/mojzig</primerak_znaka>
        <spisak_robe_usluga>https://www.prilog.com/mojzig</spisak_robe_usluga>
        <punomocje>https://www.prilog.com/mojzig</punomocje>
        <generalno_punomocje_ranije_prilozeno>https://www.prilog.com/mojzig</generalno_punomocje_ranije_prilozeno>
        <punomocje_naknadno_dostavljeno>https://www.prilog.com/mojzig</punomocje_naknadno_dostavljeno>
        <opsti_akt_o_kolektivnom_zigu>https://www.prilog.com/mojzig</opsti_akt_o_kolektivnom_zigu>
        <dokaz_o_pravu_prvenstva>https://www.prilog.com/mojzig</dokaz_o_pravu_prvenstva>
        <dokaz_o_uplati_takse>https://www.prilog.com/mojzig</dokaz_o_uplati_takse>
    </prilozi>
</zahtev_za_priznanje_ziga>